nexta live,михал подоляк текущий положение,2022-03-16
nexta live,токай послание народ казахстан обозначить программа политический реформа выглядеть переход суперпрезидентский форма правление президентский республика сильный парламент запрет участие президент,2022-03-16
nexta live,автоваз отправить сотрудник отпуск день изз кризис поставка ранее корпоративный отпуск компания запланировать период июль август решить перенести связь кризис,2022-03-16
nexta live,актуальный карта боевой действие генштаб всу,2022-03-16
nexta live,владимир чиркин бывший главком сухопутный войско рф коготь остаться сомнение повод адекватность российский военоначальник,2022-03-16
nexta live,депутат новосибирский горcовета пирогов хельга прийти сессия такой вид внимание,2022-03-16
nexta live,рубежный вражеский обстрел пострадать бассейн,2022-03-16
nexta live,результат ночной обстрел произойти обвал жилой дом киев предварительный информация пострадать человек эвакуировать место продолжать спасатель,2022-03-16
