ftp,солевой житель омск похитить планшет выбежать магазин внезапно погнаться продавцыконсультант униформа погоня остановить водитель такси сбить грабитель неудачливый воришка госпитализировать,2021-10-30
ftp,умереть бабушка мужчина переодеться костюм врач пробраться больница пенсионерка положить ковидный госпиталь мсч неделя внук узнать бабушка не оказывать должный,2021-10-30
ftp,москва студент уговорить ограбить мигрант сперва догнать вернуть телефон перевод номер изз преступник поймать автор схема инженерэколог российский университет транспорт,2021-10-30
ftp,питер охранник эрмитаж сломать нос мужчина замешкаться вход поиск qrкод музей объяснить общий нервозность фон пандемия новый режим работа локдаун,2021-10-30
ftp,бельгия семья оказаться разводный мост неожиданно начать подниматься итог находиться автомобиль получить лёгкий травма,2021-10-30
ftp,путин распространить льготный ипотека дорогой жильё связь стоимость недвижимость резко повыситься согласно исследование сбериндекс рост цена жильё превысить эффект льготный,2021-10-30
ftp,подмосковье девочка который увести педофил выследить умный час виктория пропасть посёлок купавушка час девочка уйти гулять домой назначить не вернуться,2021-10-30
ftp,глава росфинмониторинг заявить внутриигровой валюта шутер использоваться финансирование терроризм пойти система внутриигровой валюта называться интернет играть какиеть стрелялка условно говорить,2021-10-30
ftp,ульяновский область уволить священник пост готовность пожать рука навальный руководитель информационногоиздательский отдел мелекесский епархия иерей георгий сухобокий уволить написать соцсеть,2021-10-30
ftp,жизнь скончаться журналист игорь кирилл вести программа,2021-10-30
ftp,казахстан школьник знак протест прислать учёба юбка выразить солидарность одноклассник совершить суицид беседа психолог восьмиклассник появиться мероприятие посвятить герой гарри,2021-10-30
ftp,вечно путать интересный канал pochuvstvuyraznicu pochuvstvuyraznicu pochuvstvuyraznicu советовать подписка,2021-10-29
ftp,суд утвердить мировой соглашение олег тинькова американский министерство юстиция дело нарушение налоговый законодательство заплатить штраф доллар власть отказаться дальнейший уголовный,2021-10-29
ftp,треть россиянин назвать пытка тюрьма недопустимый половина россиянин считать насилие заключить недопустимо какой обстоятельство следовать результат опрос левадацентр опросить заявить,2021-10-29
ftp,житель томск имя сергей переодеться врач показать быт местный больница изнутри наплевательский отношение медик грязь уволить работа семья мужчина остаться,2021-10-29
ftp,netflix показать трейлер второй сезон ведьмак релиз наметить декабрь ремикс трек канье уэст качество саундтрек геральт пытаться спасти человек чудовище,2021-10-29
ftp,депутат алтайский край трижды оправдать дело избиение человек причём пострадать умереть депутат алтайский райсобрание роман бруннер быть директор местный предприятие,2021-10-29
ftp,бургер кинг подать жалоба фас telegram изз ранее павел дуров запретить продвигать фастфуд новый рекламный платформа бургер кинг обвинять мессенджер,2021-10-29
ftp,артхаус заслужить,2021-10-29
ftp,блогер руслан бобиева подруга анастасия чистов приговорить месяц колония съёмка фон храм василий блаженный признать виновный оскорбление чувство верующий,2021-10-29
ftp,шоу важный организация вручение премия росмолодёжь потратить деньга выплата лауреат сайт премия сказать вручаться вклад область решение мировой гуманитарный проблема,2021-10-29
ftp,блогерадиггер андрей пыж приговорить пять год колония незаконный доступ гостайна выкладывать видос канал urbanturizm посвятить забросить объект получить срок сведение,2021-10-29
ftp,валерий рашкина поймать убитый лосёма машина инцидент произойти лысогорский район саратовский область коммунист отказаться прохождение медицинский освидетельствование состояние опьянение вспомниться,2021-10-29
ftp,бывший гендиректор зимний вишня приговорить год колония напомнить пожар торговый центр унести жизнь больший ребёнок полный список осудить выглядеть бывший,2021-10-29
ftp,tesla принадлежащий сын миллиардер эксдепутат госдума александр скоробогатько врезаться столб сгореть москва авария произойти район станция метро прокшиный автомобиль разорвать,2021-10-28
ftp,росгосстрах потребовать семья погибший поезд школьник рубль ремонт электричка ноябрь подмосковный солнечногорск электричка насмерть сбить подросток переходить платформа друг наушник,2021-10-28
ftp,власть озаботиться защищённость информационный система утечка видеозапись пытка тюрьма минцифра департамент информтехнология мэрия москва практически одновременно заказать поиск дыра компьютерный,2021-10-28
ftp,бурятия впервые история пройти соревнование скоростной копание могила ради престиж данный случай профессия землекоп многие работа недооценивать победитель конкурс управиться,2021-10-28
ftp,власть москва следить перемещение гражданин мобильный телефон потратить млн рубль власть москва выделить млн рубль статистический отчёт численность перемещение гражданин,2021-10-28
ftp,январский митинг закончиться силовик никак не успокоиться москва задержать участник протест якобы ударить нога росгвардеец уголовный применение насилие представитель власть,2021-10-28
ftp,пенсионный фонд россия приостанавливать строительство новый здание похоже деньга пенсионный фонд становиться пенсионер,2021-10-28
ftp,вчера генеральный штаб вооружённый сила украина опубликовать видео первый боевой применение турецкий ударный беспилотник bayraktar роспотребнадзор октябрь приостановить ввоз турецкий,2021-10-28
ftp,единоросс отклонить законопроект полный освобождение участник великий отечественный война коммунальный платёж главное моргенштерный заставить извиниться оскорбление ветеран,2021-10-28
ftp,задержать подозрение тройной убийство мосфильмовский покончить самоубийство вчера андрей скрипкина задержать белоруссия скрыться убийство банкир михаил яхонтовый семья должный отправить,2021-10-28
ftp,кремль готовить новый кампания пропаганда вакцинация ковид сообщать коммерсант заняться тема поручить замглавы ап сергей кириенко сообщать источник издание слово,2021-10-28
ftp,подозревать убийство банкир михаил яхонтовый семья удаться отследить система поток успеть добраться белоруссия задержать андрей скрипкина передвигаться автомобиль такси hyundai,2021-10-27
ftp,реакция итальянский сенат депутат проголосовать закон борьба гомофобия инициатива ddl zan предполагать ввести наказание дискриминация гей лесбиянка трансгендер май предложить,2021-10-27
ftp,бастрыкин выступить новый важный поручение потребовать разобраться картина питерский художник живой идти портрет мёртвый напомнить бессмертный полк вчера поручить проверить,2021-10-27
ftp,житель томск переодеться костюм врач пробраться бабушка красный зона не ухаживать бабушка мужчина попасть ковидный госпиталь мсч пневмония переживать здоровье,2021-10-27
ftp,путин заявить продолжить безвозмездный основа предоставлять тест другой страна путин щедрый свой платно иностранец бесплатно,2021-10-27
ftp,власть грузия депортировать прибыть страна украинский журналист дмитрий гордон поставить факт аэропорт тбилиси не назвать причина запрет въезд отметить гордон,2021-10-27
ftp,больница красноярский край подача кислород вместо банка система бобров использовать бутылка изпод минеральный вода,2021-10-27
ftp,москва посылка доставлять специальный робот почта россия идти нога время жаль не время доставка,2021-10-27
ftp,вдохновитель шутинг популярный музыкальный группа власть постоянно запрещать выступать политический мотив отповедь рэпер моргенштерна пресссекретарить президент дмитрий песков указать музыкант,2021-10-27
ftp,роскомнадзор предложить запретить мат онлайнкинотеатр делать провокативный продукт поддержать идея депутатединоросс желание ркн запретить мат онлайнкинотеатр рассказать председатель комитет госдума,2021-10-26
ftp,видео рассказ афганский женщина вынужденный продать некоторый внуковвнучатый прокормить расходиться соцсеть страна персидский залив слово пользователь местный соцсеть преимущественно считать,2021-10-26
ftp,президент германия вручить ангел меркель официальный уведомление окончание полномочие канцлер занимать должность,2021-10-26
ftp,павел дуров прокомментировать анонс рекламный платформа павел дуров опубликовать свой канал пост анонсировать официальный рекламный платформа пояснить большинство пользователь не,2021-10-26
ftp,урал зампрокурор привязать голова машина протащить земля пытаться убить случиться утром октябрь курганский область заместитель прокурор далматовский район напасть посёлок,2021-10-26
ftp,полицейский временно остаться важный инструмент поиск угнать машина система потокпдд искать докомпьютерный эпоха система потокпдд распознать госномер автомобиль помогать отслеживать,2021-10-26
ftp,взрыв газ произойти жилой дом балтийск взрывной волна выбить окно несколько этаж огонь достать двое ребёнок пострадать,2021-10-26
ftp,мосфильмовский улица убитый семья три среди убитый бывший банкир долг млрд семья михаил яхонтовый не выходить связь воскресение знакомый забеспокоиться,2021-10-26
ftp,семь разбирательство суд амстердам постановить вернуть скифский золото украина февраль крымский музей отправить коллекция выставка голландия март крым оккупировать россия,2021-10-26
ftp,хабаровск строиться здание больница упасть строительный кран данные местный сми пострадать происшествие выехать экстренный служба,2021-10-26
ftp,пятеро студент высокий школа останкино отчислить лайк комментарий адрес учебный заведение ктоть написать останкино постоянно переносить отменять занятие платить тысяча,2021-10-26
ftp,минтранс предложить поднять тариф платный дорога уровень европейский страна максимальный стоимость проезд вырасти рубль км искусственный сооружение рубль км поднятие,2021-10-25
ftp,рогозин корабль spacex наработать достаточный опыт отправка космонавт рф рогозин заявить космонавт не пересесть корабль сша,2021-10-25
ftp,заключить саратовский областной туберкулёзный больница заявить насилие отношение слово адвокат снежана мунтянин речь идти пытка избиение вымогание деньга непосредственно колония,2021-10-25
ftp,граница польша беларусь мигрант ранить двое польский пограничник польский погранслужба опубликовать видео штурм граница среди атаковать заграждение поляк опознать белорусский,2021-10-25
ftp,вечно путать интересный канал pochuvstvuyraznicu pochuvstvuyraznicu pochuvstvuyraznicu,2021-10-25
ftp,жилой дом набережный челны произойти взрыв обрушиться крыша верхний этаж количество пострадать неизвестно upd предварительный информация взорваться газ данный момент,2021-10-25
ftp,россиянин раскупить место дорогой отель египет путинский антиковидный каникулы спрос тур египет ассоциация туроператор россия атор назвать рекордный ноябрьский выходной,2021-10-25
ftp,создание автоматизированный рабочий место российский госслужащий потратить полмиллиарда рубль минцифра выделить млн рубль создание автоматизированный рабочий место сотрудник федеральный орган,2021-10-25
ftp,okko выпустить документальный сериал рынок персональный данные интернет личный сериал рассказать число даркнуть травля смерть цифровой секс серия хронометраж минута,2021-10-25
ftp,ростовский журналист сергей резник объявить розыск известный расследование коррупция база мвд указать резник разыскиваться статья ук неизвестно претензия центр э,2021-10-25
ftp,евросоюз возвращаться афганистан ес планировать открыть дипломатический представительство писать the financial times евросоюз считать защищать право человек афганистан настаивать выполнение,2021-10-25
ftp,нормальный питание депутат кпрф николай харитон публично пожаловаться условие работа госдума утверждать чиновник вынудить ходить голодный регулярно недоедать харитон утверждать,2021-10-25
ftp,топ имя фамилия объявить розыск российский преступник сайт интерпол,2021-10-25
ftp,протест нидерланды ковидпаспорт,2021-10-24
ftp,минвод чиновник заработать ребёнок рубль глава управление имущественный отношение артур григорян сделать добрый приобрести здание размещение он детский сад естественно,2021-10-24
ftp,вчера ход совместный операция армия национальный полиция военновоздушный сила колумбия антиокия задержать дайро антонио усуг известный отониэль лидер клан дель,2021-10-24
ftp,шойгу пугать россиянин стягивание нато граница россия дочь муж находиться глубокий тыл враг,2021-10-24
ftp,беларусский пропагандон президент бункер ботекс подумать путин оказаться подумать путин плохой слово не он дружба россия топить помнить предвыборный гонка,2021-10-24
ftp,посольство узбекистан москвабад выстроиться огромный очередь желать проголосовать президентский выборы узбекистан участок открыть шесть город россия санктпетербург казань владивосток екатеринбург,2021-10-24
ftp,правительство отклонить законопроект уголовный ответственность невыполнение политик предвыборный обещание отзыв опубликовать база госдума автор законопроект выступить олег нил мнение ниловый,2021-10-24
ftp,петербург ввести локдаун октябрь ноябрь соответствовать постановление подписать губернатор александр беглов закрыть запретить общепит обслуживание навынос доставка точка вокзал азс,2021-10-24
ftp,сша отнести россиянин бездомный национальность homeless nationalities госдеп сша включать категория человек страна нестабильный политический ситуация либо штат консульский представительство,2021-10-24
ftp,массовый убийство собака произойти частный приют воронеж неизвестный проникнуть территория убить животное полиция возбудить уголовный бедолага отравить слово очевидец пулевой,2021-10-23
ftp,ростовский область сотрудник дпс неадекватно отреагировать участник дтп мужчина поинтересоваться полицейский проводиться замереть тонировка ответ потребовать убрать камера выйти служебный,2021-10-23
ftp,сергей савельев прокомментировать заочный арест объявление розыск хотеться верить признавать факт пытка пытаться урегулировать пытка пытаться утрясти история разглашение государственный,2021-10-23
ftp,фестиваль екатеринбург поехать солист агат кристи вадим самойлов сцена заявить болеть либеральный хи обвинить ельцинцентр контрпропаганда антигосударственный деятельность высказаться представитель,2021-10-23
ftp,постишь кот завтра митинг готовый,2021-10-23
ftp,бывший заключить автор архив фсин сергей савельев объявить розыск статья ук находиться производство главное управление уголовный розыск мвд россия саратовский,2021-10-23
ftp,момент взрыв завод рязань попасть камера видеонаблюдение погибнуть смена,2021-10-23
