ftp,оренбург парень избить угрожать изнасиловать отделение полиция отпустить сообщить произойти ошибка трое оперативник отдел полиция оренбургский забрать генадий швецов утром,2021-10-15
ftp,аналитик рыночный отношение зафиксировать полгода цена востребовать лекарство целое страна вырасти четверть речь идти лекарство простудный заболевание сердечнососудистый недуг геморрой,2021-10-15
ftp,санктпетербург проходить счёт евразийский женский форум тысяча женщина страна собираться россия обсудить самый вопрос,2021-10-15
ftp,врач коммунарка денис проценко назвать ситуация коронавирус россия близкий критический смертность ковид побить очередной рекорд сутки умереть новый выявить случай,2021-10-15
ftp,яндекс начать самостоятельно маркировать публикация смииноагент выдача новость публикация сопровождать пометка иностранный агент нажатие который выпадать полный текст специальный плашка,2021-10-15
ftp,человек погибнуть пострадать результат подрыв смертник мечеть кандагар upd число жертва вырасти раненый,2021-10-15
ftp,цена не вырасти психологический восприятие председатель центробанк рф эльвира набиуллин поделиться свой соображение инфляция оказываться общий истерия связать подорожание продукт,2021-10-15
ftp,первоуральск горбольница посёлок динас пациент клиника ходить ужас искать медик рассказать сосед палата умереть мужчина кричать рыскать корридора не слышать,2021-10-15
ftp,оплата проезд система распознавание лицо face pay заработать станция московский метро воспользоваться система привязать фотография банковский карта карта тройка сервис,2021-10-15
ftp,башкирия представительница теплосеть ооо башртс ирина попов предлагать не платить отопление платить рассрочка,2021-10-15
ftp,лахтинец понаписать анонимный комментарий риа сделать новость лахтинец круговорот говно россия,2021-10-14
ftp,мвд белоруссия сообщить личность практически активный подписчик администратор экстремистский telegramканал установить привлечение уголовный ответственность вестись точечный индивидуально,2021-10-14
ftp,ливанский бейрут здание суд утром начаться хаос перестрелка три группировка начаться демонстрация требование отстранить главное судья тарек битара дело взрыв,2021-10-14
ftp,минюст внести реестр иноагент один организация ано защита право человек информирование население якутия мнение ранее министерство признать иноагент руководитель организация,2021-10-14
ftp,тимур бекмансур ехать сизый арестовать месяц суд пройти прямо больница провести последний неделя лишиться нога,2021-10-14
ftp,роскосмос потратить млн рубль видеоролик популяризация российский космонавтика госкорпорация роскосмос выделить млн рубль создание распространение медиаконтент способствовать популяризация российский космонавтика,2021-10-14
ftp,глава альянс врач анастасия васильев приговорить ограничение свобода заседание не пустить изз ковидный ограничение выходить дом ночной сутки выезжать предел,2021-10-14
ftp,старый оскол журнашлюха решить смотивировать прививаться прислать ковидный госпиталь тренер вольный борьба не привиться заболеть поражение лёгкий съёмка парень сообщить,2021-10-14
ftp,норвегия мужчина расстреливать человек лука сообщаться несколько убитый раненый центр город конгсберг запад осло полицейский задержать мужчина успеть убить ранить,2021-10-13
ftp,советник глава крым забанить фейсбук призыв вакцинация призвать антиваксеров привиться ковид либо покончить олег крючков рассказать переболеть коронавирус раз успеть,2021-10-13
ftp,,2021-10-13
ftp,глобально запас россия носить неограниченный планетарный характер путин запас россиянин экономить еда,2021-10-13
ftp,москва электросамокатчик ехать проезжий часть пересечение байкальский иркутский врезаться грузовик погибнуть место,2021-10-13
ftp,подписчик экстремистский телеграмканал белоруссия привлекаться уголовный ответственность сообщить телеграмканал главное управление борьба организовать преступность мвд страна подписчик экстремистский телеграмканал чат,2021-10-13
ftp,поклонской обладать ключевой негативный качество действовать политический система неуправляемый назначение поклонской посол какиенибудь остров ждать специалист говорить прошлое аналитик говорить,2021-10-13
ftp,наталья поклонской назначить посол кабоверде бывший депутат госдума наталья поклонской назначить чрезвычайный полномочный посол посол рф кабоверде стать третий действовать,2021-10-13
ftp,мэрия москва потратить рубль софт дорожный камера улучшить нейросеть смочь распознавать частично закрытый номер сотрудник гибдд смочь отслеживать машина находиться,2021-10-13
ftp,сеть слить видео дтп участие майбах который ехать ксения собчак,2021-10-13
ftp,подросток задавить машина кенгуру австралиец ради забава ездить окрестность город сбивать животное итог полиция обнаружить десяток мёртвый кенгуру один детёныш,2021-10-12
ftp,минстрой ввести новый категория ветхий жильё дом ограниченно годный проживание согласно документ жилой здание крен дефект повреждение свидетельствующий снижение несущий,2021-10-12
ftp,рф амнистировать гастарбайтер ранее выслать различный нарушение смочь работа россия,2021-10-12
ftp,следственный комитет объединить уголовный алексей навальный сторонник один написать иван жданов свой инстаграм,2021-10-12
ftp,счёт карта россиянин смочь блокировать день решение мвд фсб росфинмониторинг разработать законопроект позволять внесудебный порядок приостанавливать срок день операция банковский,2021-10-12
ftp,якутия житель труднодоступный сесть сбрасывать гнилой картошка еда самолёт власть решить доставка продукт вертолёт дорогой подведомственный предприятие минсельхоз решить сбросить,2021-10-12
ftp,омск жить ржавый железный бочка светлана чернов проработать местный завод обещать квартира качество временной жильё руководство предложить женщина пожить металлический,2021-10-12
ftp,володин вновь переизбрать пост спикер госдума кандидатура проголосовать депутат госдума избрать новый вицеспикер пост первый зампредседателя занять александр жуков едро,2021-10-12
ftp,россия ожидаться один самый высокий инфляция последний инфляция выше оккупация крым санкционный война впервые осень вместо снижение цена овощ фрукт,2021-10-12
ftp,умереть бывший официальный представитель следственный комитет рф владимир маркин маркин известный не комментатор резонансный уголовный автор колонка газета известие высказывать,2021-10-12
ftp,россиянин не хотеть путин президент высокий показатель путин хотеть президентский пост россиянин старший хотеть не хотеть респондент хотеть не хотеть,2021-10-11
ftp,коррупция связать душевно неразвитый россиянин не уметь получать удовольствие господь бог давать поровну депутат единый россия ямпольский мрот рядовой россиянин,2021-10-11
ftp,красноярский чиновник завести административный оскорбление назвать куча дерьмо плаксивый сброд местный житель жаловаться смочь лесной пожар прокуратура постановить провести лингвистический,2021-10-11
ftp,евросоюз продлить санкция россия применение химоружие санкционный список брюссель числиться россиянин российский нии причастный отравление новичок скрипаль навальный ограничение продлиться,2021-10-11
ftp,минюст удалить информация структура источник финансирование нкоиноагент причина внесение соответствовать реестр реестр содержаться общий сведение организация дата включение ранее ведомство,2021-10-11
ftp,объявить лауреат нобелевский премия экономика дэвид карда джошуа ангристый гвидо имбенс,2021-10-11
ftp,навальный снять учёт колония склонный побежать поставить учёт экстремист террорист,2021-10-11
ftp,власть рф требовать google удалить контент основный причина угроза нацбезопасность последний россия прийти запрос удаление контент остальной страна взять середина,2021-10-11
ftp,мишустин октябрь подписать постановление запуск пилотный программа ввоз трудовой мигрант узбекистан стройка рф соответствие документ процедура оформление разрешительный документ перенести,2021-10-11
ftp,питер выловить река сумка останки ребёнок полиция позвонить безработный мужчина обнаружить находка река ижора посёлок тельман находиться мост вытащить подозрительный,2021-10-11
ftp,расти цена алюминий превысить тонна впервые расти,2021-10-11
ftp,честь павел дуров составить список три недооценить семь переоценить вещь жизнь недооценить сон повышать иммунитет творческий способность психологический благополучие природа,2021-10-10
ftp,дикий ситуация киевский вокзал бить мужчина убегать решать сдача бить рука нога валита земля неудачно оказываться прямо колесо проезжать электробус,2021-10-10
ftp,google построить крыша торговый центр австралия дронопорт устройство быстрый доставлять заказ отправка посылка сотрудник подняться крыша,2021-10-10
ftp,водитель фольксваген врезаться мерседес собчак рассказать опрос пострадать пассажир помочь проезжать очевидец мерседес выйти минута пересесть такси,2021-10-10
ftp,водитель мерседес олег цой который ехать ксения собчак рассказывать произойти авария,2021-10-10
ftp,новый кадр место авария,2021-10-10
ftp,первый комментарий собчак,2021-10-10
ftp,автомобиль ксения собчак попасть дтп смертельный исход сочи мерседес телеведущий пойти обгон встречка столкнуться фольксваген который погибнуть человек собчак пересесть,2021-10-10
ftp,питер водитель врезаться каменный ограждение большеохтинский мост выйти нива спрыгнуть вода сообщать очевидец проплыть метр течение пойти к дно,2021-10-10
ftp,погибнуть крушение самолёт татарстан семеро госпитализировать пилот предварительный данные не выжить среди парашютист совершать полёт версия согласно критически перегрузить проверять,2021-10-10
ftp,канцлер австрия себастьян курц уходить отставка изз направить расследование прокуратура коррупция взяточничество,2021-10-09
ftp,фото место трагедия,2021-10-09
ftp,главный большой театр опера садко декорация придавить артист насмерть евгений кулеш скончаться приезд скорый представление остановить зритель попросить покинуть зал,2021-10-09
ftp,председатель китайский народный республика призвать мирно присоединить тайвань китай последний неделя китай значительно усилить давление тайвань посылать граница военный самолёт,2021-10-09
ftp,юрий хованский находиться питерский сизый написать письмо полный расплывчатый понятие блогер переживать не хороший время психологический состояние жалоба писать постоянно,2021-10-09
ftp,россия март начать продавать алкоголь онлайн доставка условие нововведение вино игристый креплёный российский виноград почта россия новость прокомментировать нарколог урфо,2021-10-09
ftp,борис немцов невероятный точность предсказать будущее россия исполниться,2021-10-09
ftp,учитель математика школа российский академия художество уволиться школа скандал изз откровенный фото соцсеть родитель учиться обнаружить страница фотография девушка стиль,2021-10-09
ftp,google play вернуть приложение навальный пользователь россия,2021-10-09
ftp,россиянин пугать иностранный агент нападение нато естественный убыль население россия январеавгуст вырасти сравнение период прошлое сообщать росстат естественный убыль превышение,2021-10-09
ftp,пользователь instagram fb whatsapp мир жаловаться проблема доступ эпизод ваш любимый сериал facebook сервер,2021-10-08
ftp,telegram сообщить деталь появление платный сообщение telegram тестовый режим скоро запустить сервис платный пост показываться публичный канал вначале telegram планировать,2021-10-08
ftp,минюст признать иноагент журналист компания bellingcat юрист сми сотрудник проект иноагент признать андрей захаров автор расследование третий дочь путин реестр,2021-10-08
ftp,ск завести уголовный директор казанский гимназия май ильназа галявий застрелить амин валеев обвинять преступный халатность следователь считать не озаботиться профессиональный,2021-10-08
ftp,массовый убийство суд следствие шутка изнасилование интернет запомниться филиппинский президент родриго дутерот объявить уход политика житель страна дутерот запомниться нарушение,2021-10-08
ftp,snapchat объявить усиление борьба наркотрафик приложение соцсеть запустить новый политика модерация информационный платформа отчитаться тесный сотрудничество полиция компания отреагировать прямой,2021-10-08
ftp,погибнуть пострадать взрыв шиитский мечеть север афганистан,2021-10-08
ftp,партия навальный получить фракция госдума агитация идея уг одобрить треть россиянин левадацентр обнародовать результат электоральный опрос иноагент запретить публиковать выборы,2021-10-08
ftp,главред новый газета дмитрий муратов филиппинский журналистка мария рес стать лауреат нобелевский премия,2021-10-08
ftp,москва появиться люк вид гильза память убийство политковский художник слава птрк разместить разный точка москва возле дом журналистка возле редакция,2021-10-08
ftp,путин поздравлять верховный рада кандидат должность спикер верховный рада алексей гончаренко обратиться коллега предложение спеть украинский народный песня,2021-10-08
ftp,россия уехать пять последний год эмиграция достигнуть пик основной причина эмиграция стремление безопасность новый опыт недовольство политический ситуация говориться исследование,2021-10-07
ftp,белорусский пропагандон григорий азаренок рассказывать дело спасти россия девяностый,2021-10-07
ftp,студент помочь поймать убийца три девушка гай вручить грамота содействие мвд один губернатор оренбургский область возместить затрата ремонт машина преступник,2021-10-07
ftp,подмосковье двое грабитель взорвать банкомат пятёрочка разнести магазин грабитель проникнуть магазин ночью взорвать банкомат потребоваться минута возиться аппарат удаться забрать,2021-10-07
ftp,закон предустановка смартфон российский не повысить популярность приложение свидетельствовать дать исследование telecom daily большинство пользователь iphone не скачивать приложение владелец,2021-10-07
ftp,президентский кампания стоить раз предыдущий миллиард рубль дорога владимир владимирович,2021-10-07
ftp,истечь срок давность дело убийство анна политковский журналистка новый газета застрелить рождение путин анна политковский убитый подъезд собственный дом лесной,2021-10-07
ftp,таксист яндекс насильно держать москвичка машина уговорить свидание макдональдс маша ф учиться вшэ работать музей современный искусство гараж девушка вызвать,2021-10-07
ftp,день уполномоченный право человек саратовский область надежда сухов побывать тот туберкулёзный больница фсин насиловать пытать осудить стать стыдить коммент жалоба,2021-10-06
ftp,ск беларусь сообщить арест комментарий гибель минчанин андрей зельцер сотрудник кгб ведомство заявить правоохранительный орган продолжать работа установление подобный род,2021-10-06
