ftp,нато высылать сотрудник российский миссия альянс враждебный деятельность сообщать sky news,2021-10-06
ftp,саратовский управление фсин фон скандал пытка осудить удалить инстаграм двусмысленный фото субботник тюремщик позировать лопата ранее управление оказаться центр скандал,2021-10-06
ftp,глава крым назвать лживый нечистоплотный политика уефа представить крым часть украина ранее союз европейский футбольный ассоциация уефа представить бренд логотип,2021-10-06
ftp,свежий обложка новый газета октябрь анна политковский застрелить лифт собственный дом,2021-10-06
ftp,американский фармацевтический компания merck объявить создание таблетка помогать предотвратить развитие серьёзный симптом госпитализация заболевание слово представитель merck препарат необходимо принимать,2021-10-06
ftp,биржевой цена газ европа бить рекорд тысяча куб,2021-10-06
ftp,солдатский мать перестать помогать военнослужащий изз перечень фсб данные сбор признать иноагент не смочь подать заявление преступление обстановка конкретный подразделение,2021-10-06
ftp,появиться дать указывать китай скрывать долгий считаться июль ухань начать закупать аномальный количество оборудование пцр тест,2021-10-05
ftp,павел дуров заявить рекордный рост число регистрация telegram слово разработчик приложение прийти пользователь дуров заявить безупречный работа телега кризис пообещать,2021-10-05
ftp,джигурд избить октагон виталий милоновый поединок латентный пожаловаться обман сторона организатор рассчитывать околорестлинг выйти полноценный бой главный цель джигурд вечерний,2021-10-05
ftp,прокурор нижегородский область потребовать запретить мужской государство иск подать нижегородский областной суд октябрь третий лицо прокурор указать региональный управление минюст,2021-10-05
ftp,сша допустить рассмотрение иск сбербанк втб подать семья американец погибший крушение сбить донбасс малазийский боинг родственник куин шансмана обвинять российский,2021-10-05
ftp,выйти тизер приквел игра престол сериал дракон показать период правление таргариен основный событие премьера назначить,2021-10-05
ftp,власть следить передвижение петербуржец помощь симкарта власть санктпетербург выделить млн рубль сбор данные перемещение турист горожанин рамка профилактика правонарушение тендер,2021-10-05
ftp,интернетопокалипсис разгар новый сбой netflix zoom youtube viber tinder snapchat gmail viber онлайнсервис bank of america второй крупный банк сша,2021-10-05
ftp,марк цукерберг обеднеть миллиард доллар изз сбой facebook instagram whatsapp шестой место список миллиардер версия forbes акция facebook крупный американский,2021-10-04
ftp,франция служитель католический церковь замешать педофилия дать выявить независимый комиссия французский католический церковь расследовать педофилия церковный круг год слово глава,2021-10-04
ftp,сша робот boston dynamics часть группа поддержка студенческий футбольный команда станцевать чирлидерша вставать задний лапа показать лунный походка университет купить,2021-10-04
ftp,путин установить россия отец отмечать третий воскресение октябрь близкий праздник официальный попадать октябрь,2021-10-04
ftp,грузинский рустави проходить митинг поддержка михаил саакашвили собираться возле тюрьма содержаться экспрезидент грузия,2021-10-04
ftp,стать известный ужасающий подробность тройной убийство гай тело жертва психопат обнаружить след сексуальный насилие экспертиза установить девушка напоить снотворный изнасилование,2021-10-04
ftp,власть россия практически полностью закрыть рынок медицинский оборудование иностранный компания поставщик импортный томограф ивл аппарат узи действовать правило лишний не,2021-10-04
ftp,автор жалоба медуза историипосле стать иноагент обратиться генпрокуратура изз архив пандора бывший член московский общественный наблюдательный комиссия александр ион сообщить,2021-10-04
ftp,мир опубликовать расследование офшор досье пандора риа новость писать зеленский упоминание офшор эрнст кривоногий падчерица чемезов медиазона наоборот рассказать расследование,2021-10-03
ftp,любительский видео кадр задержание убийца причастность преступление определить экспертиза днк,2021-10-03
ftp,подозревать убийство три студентка медколледж оренбургский область задержать упырь поймать орск пытаться угнать автомобиль,2021-10-03
ftp,китай день подряд направлять десятка боевой самолёт число бомбардировщик способный нести ядерный оружие опознавательный зона пво тайвань пекин считать территория,2021-10-03
ftp,правительство россия четверг внести государственный дума проект бюджет будущий заложить сокращение расход ключевой социальный экономический статья финансирование система здравоохранение федеральный,2021-10-03
ftp,самолёт застрять мост аэропорт дели лайнер перевозить новый владелец слегка не рассчитать габарит уровень мост глупость,2021-10-03
ftp,появиться подозревать дело убийство три студентка медколледж гай александр лазарев оренбургский область ранее судить искать полиция,2021-10-03
ftp,профессор пермский университет отстранить работа студент который читать лекция нападение стрелка попросить учиться курс сыромятник продолжать вести занятие,2021-10-02
ftp,власть россия ожидать резкий сокращение число пенсионер страна проект бюджет пфр указать текущий количество пенсионер сократиться следующий итог прогноз власть,2021-10-02
ftp,сельсовет дмитриевский район курский область состояться представление цирк глава депутат едра виталий боевой житель село прислать заседание депутат изз хотеть,2021-10-02
ftp,ровно нижний новгород покончить журналистка редактор сетевой издание kozapress ирина славина сжечь здание управление мвд нижегородский область суицид оставить записка,2021-10-02
ftp,не жалеть пропаганда бюджет потратить поддержка госсми рекордный млрд рубль сумма бюджет регион страна согласно проект бюджет значительный рост субсидия,2021-10-02
ftp,лукашенко интервью cnn заявить случай атака запад вечный президент атаковать постоянно бомбить лишать слово лицо независимость вечный президент защищать создать,2021-10-02
ftp,покуситься святой работник кладбище янино ленинградский область заметить группа мигрант пилить оградка памятник бросать металл газель отвезти пункт приём лом,2021-10-02
ftp,фонд виолончелист ролдугин получить млрд рубль бюджет фонд талант успех среди учредитель виолончелист сергей ролдугин получить млрд рубль млрд рубль,2021-10-01
ftp,бастрыкин заинтересоваться история миасс бомж сушить носка вечный огонь кража млн раковый не,2021-10-01
ftp,прибыль роскосмос упасть раз проехаться каткий многий предприятие детище рогозин не исключение прибыль госкорпорация рухнуть млрд млнруб глава роскосмос считать,2021-10-01
ftp,михаил саакашвили задержать грузия сообщить премьер страна экспрезидент покинуть грузия приговорить тбилисский суд три шесть год лишение свобода два уголовный,2021-10-01
ftp,алексей навальный лауреат польский премия рыцарь свобода российский политик получить премия знак признание выдающийся усилие продвижение демократический ценность россия многолетний,2021-10-01
ftp,мексиканский правозащитный организация представить роботакурьер легально доставлять препарат аборт штат запретить raborta управлять дистанционно мехико правозащитник предоставлять медикамент не нарушать,2021-10-01
ftp,таможенный пункт днр лнр демонтировать октябрь граница днр лнр убрать беспрепятственно пересекать встать колено житель донбасс спустя смочь спокойно проблема,2021-10-01
ftp,пропагандонша симоньян заявить изз холод великобритания каждый зима умирать не десятка пенсионер изз невозможность позволить оплатить отопление зима проводить мальдивы,2021-10-01
ftp,сентябрь греф заявить сбербанк не планировать повышать ставка ипотека октябрь сбербанк повысить ставка ипотека сентябрь выборы октябрь выборы,2021-10-01
ftp,фсб назвать дать сбор иноагент статус собирать сведение оценка прогноз развитие военнополитический стратегический обстановка сведение дислокация вооружение численность армия полиция,2021-10-01
ftp,наталья поклонской заявить пожизненный лишение свобода суровый наказание смертный казнь отмена мораторий высокий мера счесть преждевременный решение первый очередь изз,2021-10-01
