ftp,власть санктпетербург готовиться ввести жёсткий локдаун нерабочий день московский сценарий сообщать издание фонтанка ссылаться информированный источник близкий городской правительство предполагаться,2021-10-23
ftp,правительство рф обязать мессенджер регистрировать пользователь паспортный данные уровень жизнь тотальный контроль гражданин,2021-10-23
ftp,фонд кадыров подарить mercedes два чеченский командир анзор бисаев сайти лорсанкаев получить краповый берет испытание ставрополье,2021-10-22
ftp,жительница коми оштрафовать рубль обвинение терроризм комментарий vk президент депутат,2021-10-22
ftp,бывший владелец черкизона тельман исмаил получить убежище черногория ранее арестовать запрос россия российский власть похоже не удаться заполучить беглый бизнесмен,2021-10-22
ftp,айтишник александр гончаров проводить исследование сексуальный предпочтение регион россия опрос принять участие основа ответ россиянин строиться интерактивный карта самый популярный,2021-10-22
ftp,краснодарский край мужчина смерть забить отдел полиция забрать ругаться мат вынуждать сознаться убийство сентябрь георгий кавелидзе задержать нецензурный брань доставить,2021-10-22
ftp,двор век огромный поставка нефть газ лететь прямиком недра родина рубеж пенсионерка светлана василиевич протяжение жить бочка цистерна переделать бытовка,2021-10-22
ftp,американский студентка умереть конкурс поедание хотдог подавиться задыхаться доставить больница не смочь спасти мадлен никпон учиться массачусетский университет звезда команда,2021-10-22
ftp,соцсеть дональд трамп взломать релиз зарегистрировать фейковый аккаунт республиканец журналист рассказать уязвимость площадка хакер anonymous опубликовать фейковый аккаунт трамп фотография,2021-10-22
ftp,ураган москва начать рушить кремлёвский стена сильный ветер сдуть строительный лес красный площадь мчс рекомендовать отложить прогулка столица,2021-10-22
ftp,цб повысить ключевой ставка п п годовой ключевой ставка влиять стоимость кредит депозит коммерческий банк,2021-10-22
ftp,стремиться исключение движение талибан список запретить террористический организация заявить путин российский власть не признавать движение официально регулярно проводить встреча талиб,2021-10-22
ftp,актёр алек болдуин случайно застрелить женщина съёмка фильм реквизитный пистолет стрелять сработать неправильно чп произойти съёмка фильм ржавчина ньюмексико сцена,2021-10-22
ftp,предварительно погибнуть результат взрыв завод синтетический волокно эластик рязань изз едкий запах дым вряд удаться спастись основной версия происшествие нарушение,2021-10-22
ftp,nbc заявить twitter работать китайский бот утверждать китай коронавирус изначально попасть американский омар данные телеканал китайский генеральный консул индия чжа,2021-10-21
ftp,латвия закрыть популярный русскоговорящий телеканал программа телеканал говориться коронавирус не заразный защитить употребление пища селёдка латвийский регулятор посчитать угроза общественный,2021-10-21
ftp,россия охотник педофил бороться десятый океан спорный формат процветать американский ютуба существовать не канал автор вычислять преследовать предполагать преступник отличие,2021-10-21
ftp,ресторанный бизнес ждать трудный время изз антиковидный мера связь яндекседа объявить программа поддержка заведение заработать октябрь конец ноябрь помощь ресторан,2021-10-21
ftp,суд москва дать сергей василенко месяц колония поджог колесо машина росгвардия спикер гордума тюмень единоросс еремеев устроенный дтп два погибший,2021-10-21
ftp,роскомнадзор исключить дождь список сми получать иностранный финансирование роскомнадзор исключить признанный ранее иноагент телеканал дождь список сми получать денежный средство,2021-10-21
ftp,москва московский область вводиться нерабочий день октябрь ноябрь приостанавливаться предприятие организация сфера торговля услуга общественный питание спорт культура отдых развлечение,2021-10-21
ftp,актриса спародировать официальный представитель мвд ирина волк посадить месяц лариса кривоносов прославиться известный руководитель исполком виталий наливкин несколько серия сыграть,2021-10-21
ftp,россия суд запретить продажа смартфон samsung запрет попасть модель смартфон иск подать швейцарский sqwin sa компания считать платёжный сервис samsung,2021-10-21
ftp,глава следственный комитет россия назвать следователь краснодар понаехать санктпетербург азиат киргиз таджик поджимать краснодарец понаехать возвращаться обратно глава ск рф,2021-10-21
ftp,любовь соболь объявить розыск статья ук конец сентябрь следственный комитет возбудить уголовный создание руководство экстремистский сообщество ч ст ук отношение,2021-10-20
ftp,полиция расставаться пистолет макаров служба мвд не устраивать мощность пм патрон силовик перейти пистолет лебедев патрон масса кг первый пл,2021-10-20
ftp,голодный россиянин набежать комментарий видео рацион собака потребовать автор удалить ролик отдать еда ребёнок пенсионер собака шувалов смех обоссать кресло,2021-10-20
ftp,алексей навальный получить премия сахаров свобода мысль премия ежегодно присуждать европарламент,2021-10-20
ftp,опасный преступник свобода котнаркокурьер сбежать полицейский ивановский область усатый доставлять марихуана заключить сидеть посёлок октябрьский товар вес грамм хвостатый барыга,2021-10-20
ftp,биток обновить исторический максимум данные coindesk стоимость криптомонета преодолеть отметка,2021-10-20
ftp,придумать снизить число бедный росстат начать инвалидный коляска костыль продукт молочный кухня доход россиянин товар услуга россиянин получать государство бесплатно,2021-10-20
ftp,путин объявить нерабочий день россия октябрь ноябрь поддержать мера поддержка бизнес запустить выплата объём мрот занятой малое среднее бизнес организовать,2021-10-20
ftp,половина россиянин не чувствовать защита закон половина россиянин считать россия не нарушать закон столько считать иначе следовать опрос левадацентр большинство,2021-10-20
ftp,талиб приехать переговоры москва визит россия приход власть боевик планировать просить помощь странучастница конференция,2021-10-20
ftp,мэрия москва подготовить проект краткосрочный локдаун ноябрьский праздник октябрь ноябрь ввести количество заболеть коронавирус октябрь октябрь проект локдаун закрыться продуктовый,2021-10-20
ftp,мэрия москва потребовать доступ камера тц контроль масочный режим власть требовать октябрь интегрировать камера видеонаблюдение входной группа объект единый центр,2021-10-20
ftp,юрий хованский написать новый письмо похоже желание сопротивляться пропасть дело плохой сила сдаться сдохнуть сизый лагер,2021-10-19
ftp,еспча присудить евро модератор оппозиционный чеченский похитить камера заставить сесть бутылка находиться неизвестно европейский суд право человек присудить евро салман,2021-10-19
ftp,питер трое мужчина убить киберспортсмен алексей малышев ленинградский область прохожий наткнуться возле гараж улица зелёный город никольский полуголый парень который,2021-10-19
ftp,фбр проводить обыск дом олег дерипаск вашингтон корреспондент nbc винтёр сообщать интерес федеральный агент связать дело предвыборный кампания дональд трамп,2021-10-19
ftp,навальный показать инст психологический характеристика учётный карточка фсин характеристика частность говориться навальный расковать свободный самоутверждение стремиться независимость уметь корректировать поведение,2021-10-19
ftp,половина россиянин оказаться бюджетник похоже основный экономический цель электорат зависимый подачка ипотека кабальный процент называться забота государство народ,2021-10-19
ftp,новый ограничение москва изз ковид октябрь февраль житель старший должный соблюдать домашний режим гулять заниматься спорт улица работодатель обязать перевести,2021-10-19
ftp,сеть форсить старое видео бывший мировой судья участок старое оскол масленников ен рассказывать приниматься решение дело не содержать состав преступление,2021-10-19
ftp,кремль закупить тест наркотик федеральный служба охрана заключить контракт стоимость млн рубль закупка тестполоска обнаружение наркотический средство такой информация обнаружить,2021-10-19
ftp,голиков предложить объявить нерабочий день октябрь ноябрь изз ситуация коронавирус мнение голиков некоторый регион необходимо ввести нерабочий день октябрь предложить,2021-10-19
ftp,российский команда team spirit выиграть юбилейный турнир the international грандфинал пацан победить китайский команда psglgd счёт победа получить млн,2021-10-19
ftp,сеть розничный магазин магнит пробивать новый дно петербургский сценарист автор комикс виталий терлецкий обвинить магнит плагиат персонаж комикс продукт создать,2021-10-19
ftp,зять известный видео пиво разыскивать убийство грабёж история алексей щетинин заслуживать основа хороший ситком любимый зять вирусный тикток тёща бежать,2021-10-19
ftp,нато окончательно свернуть прямой контакт отношение вернуться состояние тридцатилетний давность,2021-10-19
ftp,депутат госдума рф николай валуев немножко навалить кринж успех российский команда the international игра dota серьёзный показатель самый главное головастый,2021-10-19
ftp,делегация талибан глава второй заместитель премьера абдулсалам ханафи вылететь россия участие заседание московский формат сообщать прессслужба исламский эмират афганистан переговоры,2021-10-18
ftp,apple пройти презентация показать новый airpods macbook новый процессор pro max airpods дизайн объёмный звук dolby atmos длинный срок работа,2021-10-18
ftp,власть петербург объявить введение qrкод посещение мероприятие ресторан магазин общественный место новый правило начать действовать ноябрь первый этап пропуск посещать,2021-10-18
ftp,apple telegram анонсировать самый мощный macbook мир,2021-10-18
ftp,неделя второй тур выборы орган местный самоуправление правящий партия грузинский мечта опубликовать ролик дискредитировать саакашвили,2021-10-18
ftp,роскомпозор рассказать рф заблокировать запретить материал жалоба гражданин больший процент игнорирование требование роскомнадзор наблюдаться facebook youtube,2021-10-18
ftp,ноябрь приостановить работа постоянный представительство нато заявить глава мид лавров предложить альянс поддерживать контакт посол россия бельгия не видеть необходимость,2021-10-18
ftp,мужской государство суд запретить движение признать экстремистский процесс начаться иск нижегородский прокуратура не понравиться мужской государство заниматься травля угроза преследование,2021-10-18
ftp,депутат госдума светлана журов победа российский команда dota the international заявить изз киберспорт россия стать олимпийский чемпион олимпийский чемпион сидеть,2021-10-18
ftp,председатель ск россия александр бастрыкин потребовать разобраться ситуация не глава ск требовать губернатор омский область александр бурков разобраться резонансный случай,2021-10-18
ftp,тулунский маньяк приговорить год колония строгий режим совершить три десяток преступление минимум изнасилование убийство увы многий истечь срок давность расследование,2021-10-18
ftp,китайский восхищение,2021-10-18
ftp,внуково приготовиться встречать team spirit триумфатор the international наружка например идти аэропорт,2021-10-18
ftp,традиционный воскресный марш варшава белорус креативить выражать ненависть лукашенко,2021-10-18
ftp,краповый берет бунтовать возмутить хитрость уроженец чечня проходить экзамен мнение схитрить несмотря нарушение участник чечня равно стать обладатель заветный берет,2021-10-18
ftp,бывший босс киберспортсмен virtuspro антон черепенник решить поставить миллион рубль победа российский команда team spirit турнир dota не прогадать выиграть,2021-10-17
ftp,впервые история киберспорт команда россия победить чемпионат team spirit победить lgd финал the international заработать,2021-10-17
ftp,кострома магнит сотрудник чоп избить покупатель версия парень случайно разбить бутылка алкоголь,2021-10-17
ftp,папакак слово,2021-10-17
ftp,третий годовщина трагедия керченский политехнический колледж открыть монумент память погибнуть гранитный постамент написать имя погибнуть памятник выполнить вид прострелить тетрадь,2021-10-17
ftp,берлин полиция выселить левый активист захватить пустой пятиэтажный захват продаваться выселить оттуда активист никто не удаться вернуть владелец полиция прийтись,2021-10-17
ftp,октябой гражданин россия впервые отмечать отец праздник установить указ президент октябрь,2021-10-17
ftp,рофл волк стрит мем новость инвестиция трейдинг,2021-10-17
ftp,французский журналист попросить талиб показать афганистан глобус результат предсказуемый,2021-10-17
ftp,мигрант штурмовать граница польша беларусь незаконный власть беларусь наладить доставка мигрант ирак граница ес польский пограничник пытаться не допустить незаконный,2021-10-17
ftp,дносеть вконтакте помечать фейк российский губернатор частность пользователь сообщаться недостоверный являться сообщение новогодний поздравление глава свердловский область евгений куйвашева якобы,2021-10-16
ftp,белорусский программист слить гигабайт видео пытка учреждение фсин просить убежище франция правозащитник сообщать европа попасть африка прийтись скрываться фсб,2021-10-16
ftp,подмосковный город клин массовый отравление школьник вчера ребёнок попасть больница признак пищевой отравление завтрак многие почувствовать плохо потребоваться помощь медик,2021-10-16
ftp,мвд разработать поправка пдд электросамокат новый правило опеределять понятие сие средство индивидуальный мобильность электросамокат электроскейтборд гироскутер сегвей моноколесо иной аналогичный,2021-10-16
ftp,челябинский суд сократить срок бывший депутат осудить развращение девочка апелляционный инстанция челябинский областной суд сократить семь срок колония строгий режим,2021-10-16
ftp,глубокий ночью территория колония владикавказ войти спецназ бунт подавить заключить разделить группа отправить колония строгий режим первый группа активный зачинщик,2021-10-16
ftp,сша школьный футбольный матч стадион начаться стрельба ранить минимум человек стрелка не найти,2021-10-16
ftp,слово осудить сотрудник колония начать избивать заключить содержаться шизый резиновый дубинка издевательство прекратиться арестант порезать вена медицинский помощь не оказать,2021-10-15
ftp,шестьсот заключить устроить бунт исправительный колония владикавказ заключить разбить камера наблюдение внутренний дверь территория колония сотрудник спецподразделение готовиться штурм здание,2021-10-15
ftp,минюст рф внести реестр смииностранный агент москоу диджитал медиа republic рсбалта иа росбалт реестр иностранный агент минюст сми физический лицо,2021-10-15
